{"$schema":"https://json-schema.org/draft/2020-12/schema","$id":"https://raw.githubusercontent.com/cyber-sentinel/Cyber-Sentinel-Atlas/main/schemas/ingestion/v1/connector-definition.schema.json","title":"SourceConnectorDefinition","type":"object","additionalProperties":false,"required":["ingestion_contract_version","connector_id","source_id","connector_version","status","purpose","transport","acquisition_strategy","targets","parser_binding","refresh_policy_ref","change_detection_policy_ref","security_policy","retention_policy"],"properties":{"ingestion_contract_version":{"$ref":"https://raw.githubusercontent.com/cyber-sentinel/Cyber-Sentinel-Atlas/main/schemas/ingestion/v1/defs/common.schema.json#/$defs/contract_version"},"connector_id":{"$ref":"https://raw.githubusercontent.com/cyber-sentinel/Cyber-Sentinel-Atlas/main/schemas/ingestion/v1/defs/common.schema.json#/$defs/artifact_id"},"source_id":{"$ref":"https://raw.githubusercontent.com/cyber-sentinel/Cyber-Sentinel-Atlas/main/schemas/ingestion/v1/defs/common.schema.json#/$defs/canonical_id"},"connector_version":{"$ref":"https://raw.githubusercontent.com/cyber-sentinel/Cyber-Sentinel-Atlas/main/schemas/ingestion/v1/defs/common.schema.json#/$defs/semver"},"status":{"$ref":"https://raw.githubusercontent.com/cyber-sentinel/Cyber-Sentinel-Atlas/main/schemas/ingestion/v1/defs/common.schema.json#/$defs/status"},"purpose":{"type":"string","minLength":1},"transport":{"$ref":"https://raw.githubusercontent.com/cyber-sentinel/Cyber-Sentinel-Atlas/main/schemas/ingestion/v1/defs/common.schema.json#/$defs/transport"},"acquisition_strategy":{"$ref":"https://raw.githubusercontent.com/cyber-sentinel/Cyber-Sentinel-Atlas/main/schemas/ingestion/v1/defs/common.schema.json#/$defs/acquisition_strategy"},"targets":{"type":"array","minItems":1,"items":{"type":"object","additionalProperties":false,"required":["target_key","required","resource_uri","discovery"],"properties":{"target_key":{"type":"string","pattern":"^[a-z0-9][a-z0-9._-]*$"},"required":{"type":"boolean"},"resource_uri":{"type":"string","format":"uri"},"allowed_path_prefixes":{"type":"array","uniqueItems":true,"items":{"type":"string","minLength":1}},"discovery":{"type":"object","additionalProperties":false,"required":["dynamic","max_resources","max_depth"],"properties":{"dynamic":{"type":"boolean"},"max_resources":{"type":"integer","minimum":1,"maximum":100000},"max_depth":{"type":"integer","minimum":0,"maximum":64}}}}}},"parser_binding":{"type":"object","additionalProperties":false,"required":["parser_id","parser_version"],"properties":{"parser_id":{"$ref":"https://raw.githubusercontent.com/cyber-sentinel/Cyber-Sentinel-Atlas/main/schemas/ingestion/v1/defs/common.schema.json#/$defs/artifact_id"},"parser_version":{"$ref":"https://raw.githubusercontent.com/cyber-sentinel/Cyber-Sentinel-Atlas/main/schemas/ingestion/v1/defs/common.schema.json#/$defs/semver"}}},"refresh_policy_ref":{"type":"string","minLength":1},"change_detection_policy_ref":{"type":"string","minLength":1},"auth_profile_ref":{"type":"string","pattern":"^atlas:auth-profile:atlas\\.ingestion:[a-z0-9][a-z0-9._-]*$"},"security_policy":{"$ref":"https://raw.githubusercontent.com/cyber-sentinel/Cyber-Sentinel-Atlas/main/schemas/ingestion/v1/defs/common.schema.json#/$defs/security_policy"},"retention_policy":{"type":"object","additionalProperties":false,"required":["basis","source_policy_field"],"properties":{"basis":{"const":"source-record"},"source_policy_field":{"const":"redistribution.policy"}}}}}
