{
  "ingestion_contract_version": "1.0.0",
  "connector_id": "atlas:connector:atlas.ingestion:microsoft-windows-security-event-4688-doc",
  "source_id": "atlas:source:atlas.source:microsoft-windows-security-auditing-4688-doc",
  "connector_version": "1.0.0",
  "status": "active",
  "purpose": "Acquire the official Microsoft Learn Event 4688 documentation as a bounded mutable documentation source; every retrieval becomes an immutable RawSnapshot before parsing.",
  "transport": "https",
  "acquisition_strategy": "single-document",
  "targets": [
    {
      "target_key": "event-4688-page",
      "required": true,
      "resource_uri": "https://learn.microsoft.com/en-us/previous-versions/windows/it-pro/windows-10/security/threat-protection/auditing/event-4688",
      "allowed_path_prefixes": [
        "/en-us/previous-versions/windows/it-pro/windows-10/security/threat-protection/auditing/"
      ],
      "discovery": {"dynamic": false, "max_resources": 1, "max_depth": 0}
    }
  ],
  "parser_binding": {
    "parser_id": "atlas:parser:atlas.ingestion:microsoft-windows-security-event-html",
    "parser_version": "1.0.0"
  },
  "refresh_policy_ref": "source:freshness_policy",
  "change_detection_policy_ref": "source:change_detection_policy",
  "security_policy": {
    "tls_verify": true,
    "allowed_hosts": ["learn.microsoft.com"],
    "redirect_limit": 0,
    "block_private_destinations": true,
    "max_response_bytes": 2097152,
    "max_decompressed_bytes": 2097152,
    "max_archive_entries": 1,
    "max_compression_ratio": 10,
    "connect_timeout_seconds": 10,
    "read_timeout_seconds": 60,
    "archive_safety": {
      "reject_path_traversal": true,
      "reject_absolute_paths": true,
      "reject_symlink_escape": true,
      "reject_device_files": true
    },
    "uri_sanitization": {"reject_userinfo": true, "reject_signed_query": true},
    "git_safety": {
      "submodules": false,
      "hooks": false,
      "credential_helpers": false,
      "execute_source": false,
      "follow_symlinks": false
    }
  },
  "retention_policy": {"basis": "source-record", "source_policy_field": "redistribution.policy"}
}
